{
  "schema": "hideout.publication-receipt/v1",
  "status": "public-verified",
  "observedAt": "2026-07-15T04:12:18Z",
  "version": "0.1.0-alpha.1",
  "tag": "v0.1.0-alpha.1",
  "sourceCommit": "fc56288138d320d93032e528788b6ac3f3f81634",
  "releaseId": 353575299,
  "url": "https://github.com/vibe-agi/hideout/releases/tag/v0.1.0-alpha.1",
  "prerelease": true,
  "immutable": true,
  "package": {
    "name": "hideout",
    "productVersion": "0.1.0-alpha.1",
    "sourceCommit": "fc56288138d320d93032e528788b6ac3f3f81634",
    "artifactSHA256": "9a35bbb70b298456dd7e001a1c22825cdff180309306e8a27271e995a81473b4",
    "hostOS": "darwin",
    "hostArch": "arm64"
  },
  "evidenceSHA256": "8b0fbd79590c36eb884b2c522571f4abedc3a187fb1e9ff5c692c6c1a5c9b163",
  "assets": [
    {
      "name": "SHA256SUMS",
      "bytes": 316,
      "apiSHA256": "4e77ce044497d1659809d7d496eebbbdca59265e9e5a521b82d5e7a36addadbc",
      "downloadSHA256": "4e77ce044497d1659809d7d496eebbbdca59265e9e5a521b82d5e7a36addadbc"
    },
    {
      "name": "hideout-v0.1.0-alpha.1-darwin-arm64.tar.gz",
      "bytes": 38634485,
      "apiSHA256": "9a35bbb70b298456dd7e001a1c22825cdff180309306e8a27271e995a81473b4",
      "downloadSHA256": "9a35bbb70b298456dd7e001a1c22825cdff180309306e8a27271e995a81473b4"
    },
    {
      "name": "hideout-v0.1.0-alpha.1-evidence.tar.gz",
      "bytes": 19840,
      "apiSHA256": "8b0fbd79590c36eb884b2c522571f4abedc3a187fb1e9ff5c692c6c1a5c9b163",
      "downloadSHA256": "8b0fbd79590c36eb884b2c522571f4abedc3a187fb1e9ff5c692c6c1a5c9b163"
    },
    {
      "name": "hideout-v0.1.0-alpha.1-release.json",
      "bytes": 2587,
      "apiSHA256": "1d8627dd8706c8c8de3f19ca7bf60bd93e9cbdfd58a6549de4a77c89731065d7",
      "downloadSHA256": "1d8627dd8706c8c8de3f19ca7bf60bd93e9cbdfd58a6549de4a77c89731065d7"
    }
  ],
  "proofStatus": "satisfied"
}
