{
  "schema": "hideout.publication-receipt/v1",
  "status": "public-verified",
  "observedAt": "2026-07-28T11:01:54Z",
  "version": "0.1.0-alpha.3",
  "tag": "v0.1.0-alpha.3",
  "sourceCommit": "b513945f1f30b28aefd0169110095fe8bab485c3",
  "releaseId": 360959367,
  "url": "https://github.com/vibe-agi/hideout/releases/tag/v0.1.0-alpha.3",
  "prerelease": true,
  "immutable": true,
  "package": {
    "name": "hideout",
    "productVersion": "0.1.0-alpha.3",
    "sourceCommit": "b513945f1f30b28aefd0169110095fe8bab485c3",
    "artifactSHA256": "61807ce60d7a037139713cffe475f492ee8e60cced56674ba3f0be0580e65050",
    "hostOS": "darwin",
    "hostArch": "arm64"
  },
  "evidenceSHA256": "6118b3f37790913e119e4540a4c2e6196147cefd568917511d19d6e0e04c0cec",
  "assets": [
    {
      "name": "SHA256SUMS",
      "bytes": 316,
      "apiSHA256": "287972a810964f84ebd5df035a236c74628a6a7758287a12d1c378dddcce4162",
      "downloadSHA256": "287972a810964f84ebd5df035a236c74628a6a7758287a12d1c378dddcce4162"
    },
    {
      "name": "hideout-v0.1.0-alpha.3-darwin-arm64.tar.gz",
      "bytes": 61450973,
      "apiSHA256": "61807ce60d7a037139713cffe475f492ee8e60cced56674ba3f0be0580e65050",
      "downloadSHA256": "61807ce60d7a037139713cffe475f492ee8e60cced56674ba3f0be0580e65050"
    },
    {
      "name": "hideout-v0.1.0-alpha.3-evidence.tar.gz",
      "bytes": 69455,
      "apiSHA256": "6118b3f37790913e119e4540a4c2e6196147cefd568917511d19d6e0e04c0cec",
      "downloadSHA256": "6118b3f37790913e119e4540a4c2e6196147cefd568917511d19d6e0e04c0cec"
    },
    {
      "name": "hideout-v0.1.0-alpha.3-release.json",
      "bytes": 2685,
      "apiSHA256": "8bf8ebc5ae1c3ea402631ba96bc7129123d72ea0a031a17f9b4c9769dee613e6",
      "downloadSHA256": "8bf8ebc5ae1c3ea402631ba96bc7129123d72ea0a031a17f9b4c9769dee613e6"
    }
  ],
  "proofStatus": "satisfied"
}
